"I am not happy today,I am feeling very sad"
 On days when I feel close to my partner and other friends. 
Every time I imagine that someone I love or I could contact a
 even death.
When I had been obviously unjustly treated and had no possibility
When I think about the short time that we live and relate it to
At a gathering I found myself involuntarily sitting next to two
When I realized that I was directing the feelings of discontent
I feel guilty when when I realize that I consider material things
After my girlfriend had taken her exam we went to her parent's
Continous fear of a nuclear war.
When you kill yourself with work and see the number of slakers
 doing nothing.
When someone in my family died.
To loose friends because of them over-estimating themselves.
When people next to me play the fool.
To force someone to do something that suits me.
I thought that I was going to fail a subject and so I began to
 then my friend told me that I had
 as I do not study in
I was in Sierra Nevada
I was living in a flat where things did not go very well for me. 
 they threw me out and this prejudiced people I esteem a
When I read the diary of the girl with whom I was living
The man who threw me out of the flat disgusted me.
The first time that I caressed a girl
I was going around with a girl without loving her.  Not only did
 but we did many more things.  In the end I
I met a girlfriend again after not seeing her for several months.
I was walking in the countryside alone when I came across two
 but I was afraid of them approaching me.
I was angry when my sister began to talk nonsense and to laugh at
 I vented my anger
My mother was working with a knife and we were all laughing
I read a book whose plot and expressions were obscene and in very
My mother had just been teaching me how to crochet
 a neighbour walked in.
It was about midnight and I wanted to go to the countryside (I
 in spite of it I went out for a while.  My mother got
A friend of mine suggested that I become a film extra.  The idea
One day I went to the cinema to see a film in which I was
When I miss the train and I am late
When I knew I had to go out with my mother on some errands.
I saw in an ice-cream kiosque a cockroach walking through a
One day in class
Once I had some homework to do and I did not do it.
When they phoned me from Great-Britain to tell me that I could go
 if I wished
When I was operated on the knee and had to go through rehabilitation.
In a very important basket-ball match where a lot was at stake
When a friend of mine told me that he was going to commit
A TV program on whale-hunting.
Once when I said bad things concerning a friend.
Family discord and uneasiness due to something I did not
When I passed my driving test
When my mother was robbed in a shop.
I was given an exam which I thought did not measure at all my
When I saw the film Johnny got his gun which deals with the
Some friends and I were having lunch.  Someone said something
I was alone in the bus when I tripped and fell
As I was not paying attention
When I passed the university entrance exam.
One night
When my brother was held up and robbed.
When they told me that my grandfather was rather ill.
When I see someone vomitting.
When I fell head on in a fountain.
I had to undergo an operation in Summer and so my family had to
 above all
I came across a friend with whom I had lost touch for a long
I had decided to propose to the man I liked to make a trip
 during breakfast I told him my idea.  I was
A person I trusted a lot gave me many false explanations to
I was having breakfast with a classmate and suddenly I began to
During lunch with some classmates
When a professor caught me absent-minded and not paying attention
One day
 but it was too late.
At a party
Once I failed seven subjects at school and I was terrified to
When
I have a very close friend who lives in another city and we have
 just to see her
They asked me to throw the rubbish into a dustbin which had some
The girl with whom I was going around had been forbidden to be
I was driving a friend's car
Every time
I stayed alone in the dark at night in the mountain
We were at school
 and just behind me two classmates were bothering
 During a summer holiday a French girl and I had becoe back
 I felt very sad.
Once I had to clean a lavatory which was obstructed.  It was in a
In a Mathematics class
When I lost my study grant without having attended any exam in
 and it was too late to cancel my registration.
A party I went to last Christmas.
When my mother had a nervous illness.
During my last exam.
When I had to come back from my village last Christmas.
One day I went to see a rather disagreeable film (X).
Once I had to visit a rather special person.
Once
When I knew the feelings of a beloved person.
A fall during a climb
On the occasion of assignment of tasks and responsibilities in
 dispropotionately carried with it high
Moving to an unknown place
When I had to sleep in a bed at a hostel
While shopping
Incomprehension and repression towards a child's behaviour
 and making the child cry.
In a dark street at 4 o'clock in the night and there was
When they broke the artistic work of several weeks.  Changes were
 they had no right to
When the train taking me to my military service left the station
 projects and goodtimes.  I
A situation of overt unfairness
A children's film in which I played a clown
When a close classmate failed a year.
I was talking to a friend and he said something which was very
When I was young I saw a horror film.  Then when I went to sleep
In a confrontation with a person
I was watching a sad film and it affected me deeply.
When I was reading a book.  It had nothing to do with the book
In class I had to say something aloud and people reacted  by
In an exam I answered the questions rather carelessly and
When I knew that there were
It was more that fear - anguish -that I felt before my last exam.
When I had an argument with my best friend and I thought that I
When I realized that it was impossible for me to be as free as I
The first time I saw a pornographic film
 disgusting and dehumanizing.
When I stated sharply something I was not very sure of and a few
When I do or say something inappropriate which hurts people close
When a study tour got confirmed
I was walking down a road and suddenly a few dogs appeared at a fence
When I knew that they would not give me a transfer from one
 I ended up at the door.
We went to visit my mother at the residence.  She was crying and
My dog had been run over and died near the house.  We had to pick
 cold and glassy eyed
A professor was going to read aloud in class a composition of
In an exam when I answered the questions with very little
When I received my report card in C.O.U.  I was afraid of obtaining
 but they were much higher than expected.  
I was at the cinema with my sister and her boyfriend.  A man
 he left in
My father began to say incoherant things concerning my brother's and
I had failed some subjects in mathematics.
I was at the table at a French friend's house.  They served me a
This morning I spent a lot of time on my toilet and missed the
I was alone at home when I broke a figure and then mended it.  A
 I told
When I fell crazily in love with a beautiful girl and she returned
When I was caught by the police and was kept with a group of
 which added to my fear of being shut up.  I was
When I was the target of a great many insults and completely
When my best friend died
When I entered a brothel and saw two sailors with a young
When I was in a religious school my teacher showed me up in front
Having suffered a not very pretty sight
When I came across an old friend whom I had not seen for a very
I had an accident in which I hurt my eye.  I was afraid of having
When I was accused of something I had not done.
A close friend died.
I saw some images of a decapitation in a horror film.
I slipped and fell in to a puddle and people started looking at
I made another person cry for an unjustified cause.
I received an unexpected letter from a friend I had met a short
I was walking with another person when a gang separted us and
 hit me in the stomach and the face
A certain person started to say dreadful things very calmly
A certain person whom I respect and esteem a lot pays me no
In a bus I fell sick and vomitted in a bag.  The entire situation
A person (a male) told me that he liked me.  He has a problem
I rejected a person whom I had always thought to be a friend.  I
When I received some good news : I obtained an amount of money I
When my relatives and I were in a car going slowly on a frozen
My parents were having a typical family argument.  I came in and
I was going away
I visited a place in Morocco where they worked the leather.  I
At a friend's party there were several allusions to my sexual adventures.
I was in a cafe with another person when
When I talk to my friends.
When I am walking on the streets and see a gang of thugs.
When people harrass me I feel oppressed by their behavior.
When I am with a friend and we have to leave each other.
When I saw a film in which the man suffered from an illness and   
When I was in the toilet and someone came in.
 When I act thinking that I know everything and I then realize
 thus hurting
 Any situation in everyday life has this emotional sense
 in the street
On a dark night I felt that there were several people near me
When I learned that several people had died in the street due to 
When I saw in the newspapers
The physical appearance of a meal.
I was with a group of people and everybody told me to do or say
 strong and traumatic situation
In a situation with my girlfriend I took a decision.  Later when
 I realized that it was an erroneous decision.
One night
 around me.
During a demonstration I climbed up the closed central door of a
When I saw parents punishing their little child for something he
 even if he had done it he should
A friend of mine was hurt as he thought that our relationship was
When I was young
The parents of a friend of mine surprised us and another couple
A friend of mine felt bad because of something I had done to
When they told me that I had been admitted to the faculty of
Almost always when I go to fetch the results of an exam.
 No description.
When I decided not to out any longer with a girl whom I liked
I saw a program on T.V where they had to saw a skull for an       
I was watching T.V with my parents and some pornographic scenes
 I felt uncomfortable and tried to distract my parents
When I used an adjective for a person without knowing what it
 I felt guilty as it was
When I obtained good marks in a subject I had failed before.
When a friend of mine told me a horror story.
I was with my family and we found some abandoned puppies.  I
At my grandfather's death.
Seeing a film in which there were several bloody crimes.
At a concert an old man arrived and began to danse
I had an argument with a friend of mine.  She would not let me
When I was told that they had got tickets for me for a film
We were on the road in a car when a lorry bypassed us.  We had to
I had applied for a job and they had assured me that the exams
I received a letter from some friends
I found a big
I was in a very small class and the professor said something
I had arranged to meet my friends at a certain place
The man I am going around with gave me a very special present.
I thought that I would be scolded for a comment I had made
My sister came back home and reproached me for not having tidied
 although I had been working all morning and she had
At my grandfather's funeral.  I remembered that the thing he
 I thought that he had
I had to wash my grandmother because she did not get to the
In a very crowded shop I was distracted and missed my turn in the
When I was very young
When I saw a friend of mine
I was in my village when a bull jumped over a fence and started
When I saw a car run over a child
I failed a subject despite the fact that I had studied quite a
When I was walking in a field which had a lot of manure.
I liked a boy and I would feel shy and then blush.  The more I
I am not very affectionate and I feel guilty as I do not give as
I was spending the week-end with some friends.  We were waiting
 a 
 but at last we found
I was walking down a little village at night.  There was nobody
 I felt that it was following
 the other dogs started barking too.  At
My parents did not let me go on holidays with my friends.
I was told that a friend of mine was going to Mexico for good.
Finding a hair in the soup.
I was at the University dining room
I had promised to say goodbye to a person who was going on a
 and I did not turn up.
I was on holidays
We were camping in the mountains
I sent a book to a friend of mine.  The book meant a lot to me
To say goodbye to dear friends after the holidays.
Ever since I have been a child
At the seaside
One night
 my
My sister in law was about to have a child
 everything 
Waiting for my marks in a difficult subject.
I gave some personal information to a friend of mine
The holidays come to an end
There was a cat on the street.  It had been run over and its head was
At a meeting with over one hundred people
I had a small argument with a relative and some other people got
Last course
I was attacked by a man at a bus stop at night.
My mother told me that I could not go to the mountains.  Despite
 as long as I am in her house I must do what she says.
When my nephew was taken to hospital with meningitis and we did
I was drinking coffee in a cafe and I found a piece of scrubber
When I went to my boyfriend's house for lunch and saw his
 I felt that they were watching me all the time.
At school
 and she punished the entire class by making them
One evening
We were walking in the park at night.  It was very dark and very
 and we could
 One day I arrived home rather tired and found the house..... In
I was selected to do a rest for a foreign ballet but I did not
In a film there was a scene in which a rat was sliding on a bed
 finally it entered the mouth of
I was swimming in the river and I lost the top of my bikini.  I
At a party
It was Saturday
One night
When I got to know about the reaction of a friend of mine in a
I felt alone among a large number of people.  I was sad to see
I saw a sort of black worm being attacked by many ants.
When I met a friend of mine after several months.  
When I noticed the negative changes in a friend's behaviour. 
I was going to my village
I was watching a procession during the Holy week
My mother read a letter that a friend of mine had written to me
 No response.
I found a cockroach crushed between two folders in my bedroom
I ride my motorbike in my village and everyone stares at me as if
I was spending a few days at my aunt's place.  One night I got
 I had told them I was going to a party but I went
Last Summer I achieved someting that I had been wanting for a
I was in a camp and went out for a walk at night on my own.  I lost 
My parents scolded me a lot for something I had not done.  It was
 No response.
At the hypocrisy of some of my friends.
I greeted and embraced the wrong person thinking that it was my
Due to a misunderstanding on my part
When my brother was born
When we got lost in Florence and the coach did not turn up until
When an English teacher unfairly made me repeat a semester which
The person whom I liked most left me for a friend of mine
In a park near our home
I feel this emotion very often when I try to express my feelings
 because other people do not understand my reactions
A friend of mine said in a group that she felt lonely and
When I passed the university entrance exam.  I had thus finished
When I was at home alone
When my father made my mother go through really terrible
 I felt furious
When a person whom I loved and admired a lot died.  I felt empty
 helpless
When I came to know that my father and his parents were : self
 dirty
I think that the only time I really felt shame was when I was
When I was young I felt guilty because I thought that I had
On my birthday
We were riding in a friend's car.  He was driving very fast and
When I found one of my new pullovers wrinkled inside the
When I went to see the result of an exam and saw that I had
When I was getting up
The mother of a friend of mine passed by me and saw me sitting
A friend of mine had the sleeves of a leather coat stolen from
The final marks were to be given in the morning.  I wanted to get
I went to visit a friend in hospital.  He was going to be
A friend of mine played a joke on another friend over the
 crying
A friend of mine told me that my boyfriend had been with another
 I was at a friend's place for lunch and she fell ill and
I was dancing in a theatre.  I was not sure whether some frieends
Classes were over and I wanted to go home.  A friend of mine
On holiday
Travelling by coach on a rather narrow and wet road.
They wanted me to pay for a ticket twice because they said that
When I came back from my holidays.
When I saw an insect going up my arm.
When I entered a bar looking for a friend.
Arguing with my younger cousin.  She is rather a nuisance but I
When some friends of mine asked me to go camping with them for a
Once
When my aunt told me angrily that I was a good-for-nothing and
When my parents and sister went on a trip and I was separated
When a person I did not know hurt a friend of mine.
When the literature teacher made me recite a poem in the middle
Once
I phoned a friend of mine to ask her for news about the marks in
I was spending my summer holidays in a village.  My friend and I
 an unknown car picked up a person from this
My mother and I had an argument over buying some clothes for me. 
 and we ended up shouting at each other.
One day
When I saw a film in which there was a scene where women were cut
 it was the blood and the confusion which
I was walking to school and I passed by a red cross post where
A friend of mine trusted me to back her in a decision she had
I was told that I had passed the statistics exam.  I had not
When my brother hit his head and lost consciousness at the sports
I get angry with my brothers and sisters when they do something
When my grandfather died.
When opened a box of biscuits and found worms inside.
When I was young I was told to to the shop to buy a dozen eggs. 
When I arrived home late at night.  I know that my mother gets
When I spoke to my daughter and wished her luck for the
When I was told that my daughter
One day in a clinic
When I was told that my uncle had passed away.
The transport to pick us up for lunch was always late and the
One day when I came back home
 later I found out that it was not
When I did not give back a text book to a friend in time.
When a cousin of mine was discharged from the hospital after      
When a man who had a knife grabbed me and threatened me with it
When the neighbour of a friend of mine was stabbed to death by
When we were young
The time I shouted at most of my friends at a party.  It was as if
 or may be it was the
When I blamed my niece for misplacing my book
After going through much shame
When I was about six years old
When a person the same age as me insisted that I call him
 but he persisted and I got angry
When I lost my father on the 25th of September
When I failed the grade 7 twice and only passed it the third
I was going around with a foreigner's wife and my entire family
 this was just when I had become a
When they found out that I was absent from school
When I first passed a job interview.
I was almost caught in the girls hostel by the security men
When I was accused of having refused to do some hostel work while
A friend of mine could not make it back to Unza after having
I usually come back home early but this day I came home back late
I got pass marks in the H.S.S compulsory courses while most
I destroyed my step-brother's bedsheets by mistake
When I heard that I had made it to the second year at UNZA.
When my father's home was to be broken into by thieves who had
When a friend tried to back bite me on false grounds.  This made
When my girlfriend's nephew passed away.
When someone whom I trusted
I was with my colleagues and we met an elderly man who was very
 as he approached us he started to undress.
When I lied to my mum
When I hooked a girl in Kitwe.  She was very beautiful for my
 a rare bird of this kind accepted me as a boyfriend.
When someone tried to bewitch me and my friends at night.
When I was victimized for running away with a girl who was
1976
When I got  grade C in M160 at the end of my first year at
 going by my
When I was found urinating
 I did it.
When my uncle found me having sexual intercourse with a distant
 on the couch.  I failed to
 I carried on.
When I was accepted for further education
When I was walking at night
When I was accused by my brother of having stolen a 5 kwatcha
 the money
When I received a message that my brother was seriously ill and
When I was refused a transfer from my school to another
When I was taking an exam in grade 5.  The examinator found me
 All the students
When I was caught stealing mangoes in a certain compound.
When I got first division in the exams before leaving school.
When I went to town in a double dekker bus.  The bus was about to
When I was in form 3
When I received a letter telling me that my mother was very ill.
When a drunkard
My brother came to see me and found me with a boy friend.  When
 he did not answer and instead started
When I went to my room-mate's drawer to see if she had an iron 
 she came in.  I felt guilty as she may have
When I had my four children.
When two of my children were critically ill with measles.
When I got a low grade in an administration course.
When I got divorced from my husband after ten years of marriage.
When my mother betrayed me by obtaining money from my husband
When I gave my boyfriend a brush-off.
When I beat up my son for having beaten up his sister.
This happened when I went to check my first year results
When I woke up at night to find a fire spreading towards the bed
When a friend of mine was trying to make a fool out of me.
I experienced this emotion when my friend committed suicide after
When I heard of the assassination of the Indian prime-minister
When I got drunk at a party and made a fool of myself by
When I was caught sneaking back into the house at night after
When I was told that I had passed the exams.
When a thief broke into my house at night.
When my sister broke my china tea set.
I felt very sad when my son died after a short illness.
I met my best friend's husband with a prostitute.
When I failed to answer a simple question.
My brother wanted money but I refused to give it to him
When I learnt that I was selected for form I.
When I was nearly beaten up by the brother of my girlfriend.
When I heard that my girlfriend was talking behind my back and
When a friend
When my girlfriend told me that she was no longer interested in
I choked on a cold drink in front of girls who were strangers.
When I was caught with my girlfriend in the house at night.
When I passed the grade 7 exam.
When I was told by the doctor
When a cousin of mine took my bottle of T.B tablets
This happened when one of my uncles died just whan I was
When I realized that my closest friend had said bad things about
When five of my friends at the secondary school found out the bad
When my mother returned from a holiday
The time I qualified to enter secondary school.
One evening I saw the old guard-man I knew
 this really frightened me.
When I was mistakenly accused of being a thief when I accidently
 but the man called me a thief and called a
The day I woke up to find that a kitten I had wanted to keep had
The day I was forced to use a public convenience place in town. 
My mother caught me stealing some food when I was a young
When I gave in to what my wife wanted and locked the cat out
I felt joy when I came to know Christ.  That is when I became a
When I broke the window pane of my next door neighbour's house.
When my brother did not send me the transport money to resume     
When I heard that my nephew had passed away.
When my father thought that I was an unrelaible son.
When I stole a book in class and the teacher caught me
When I insulted an elderly person for no reason.
When my uncle gave me my first year's results.  I opened the
 this
I turned the knob of my granny's two band radio and did not hear
   What ! Have I broken the knob ? How much does
I peeped into Maurine's bedroom and saw two people - Maurine anbd
  Why did she break her promises ? Why
When I missed the chance of becoming a graduate in mining
 after having prayed one week in the church I was
I stormed into the room
  Your aunt has sold it as she
When a lady I was flirting with told all my class-mates that she
 everyone laughed
My cousin knocked on the door
 Lizzy
This was when the girl I was in love with accepted my proposal
 just as I had wanted it to.  It was
It was when I dreamt that I had encountered Satan
This was when I found out that a cousin of mine had taken away my
When I failed a test at my primary school.  I was then in grade 7
This was when I saw
This was when I was discovered stealing a piece of bread at home
When I was afraid to tell my sports teacher at secondary school
I was in grade 7.  We had an inter-house volley-ball competition.
I was escorting a relative on a bike
 suddenly
 it had vanished and moreover it did not seem to have
The comrade staying next doors insulted me for what he called 
 self centered etc. 
A close relative was at odds with a very powerful firm.  All his
 His dad had died a little before this
 he bit back his
A pig in the well from which we drink.
My girlfriend had started going around with another boy.  Her
 also a friend of mine
I bumped my dad's car in a lamp post.  He was not at home then
I was at school whhen I received a letter from the dean of my
This was at secondary school
When I travelled all the way to my former school to collect my
 only to be told that I owed them some money
